Key,Value,Note
emailName,rwnnagi@gmail.com,email name that the robot will use
emailPassword,**********,email password
hidemeUsername,rpaTest253272,username of hide.me account to signup or login
hidemePassword,Rpa@test@27382731,password of hide.me account
outputFolder,A:\rpa,the output folder thatt contains the process result files
screenshotsFolder,A:\rpa\pics,this folder contains the error screenshots
receiverEmails,******,receiver's emails that you should send the output files to them
